{
  "schema_version": "1.0",
  "task_id": "p2-d03-markdown-gate",
  "revision": 1,
  "role": "host_wireframe",
  "role_version": "1.0.0",
  "model_selection_mode": "runtime-default",
  "requested_model": null,
  "config_sha256": "48dfbd287ba942eb5c8466658612dbf7e2b5144da53f8fafddfe019ffb25a77c",
  "prompt_sha256": "ded5c374e601621f82322c63e823f46ed0d447313f3b7f7a921bba208d3ae0fe",
  "output_schema_sha256": "8a351f56f701b03d75b49636d72e928990d6336364a8a9db836597709b0a935e",
  "input_sha256": {
    "p1_state": "3e53787f609baf272a8e7f8329782ab9edaf95ba526781e7661c272a65cf4326",
    "approved_outline": "84b9f37f51468f54966b2fb3d708d0d25a31e2805620398b4c2c4d2ad6b951f0",
    "projection_manifest": "98623c0f1354b5756906d5d9f35689beff6945d117464d47aedafc64ed4cce25"
  },
  "parameters": {"temperature": 0, "top_p": 1, "seed": null},
  "call_id": "p2-d03-host-markdown-initial-20260813",
  "context_id": "root:p2-markdown-d03:initial:r001",
  "parent_context_id": null,
  "status": "succeeded"
}
